{
  "schema_version": 1,
  "spec_version": "0.1.0",
  "operations": [
    "terminal.write",
    "terminal.read_key",
    "terminal.read_line",
    "session.identity",
    "session.node",
    "session.time_left",
    "session.connection_state",
    "status.set",
    "bbs.command",
    "lifecycle.exit",
    "lifecycle.disconnect"
  ],
  "historical_apis": [
    {
      "id": "abbs",
      "kind": "historical-api",
      "rows": [
        {
          "operation": "terminal.write",
          "status": "partial",
          "symbols": [
            "Writeln",
            "Write"
          ]
        },
        {
          "operation": "terminal.read_key",
          "status": "supported",
          "symbols": [
            "GetKey"
          ]
        },
        {
          "operation": "terminal.read_line",
          "status": "supported",
          "symbols": [
            "GetString"
          ]
        },
        {
          "operation": "session.identity",
          "status": "supported",
          "symbols": [
            "UserName",
            "UserNumber"
          ]
        },
        {
          "operation": "session.node",
          "status": "missing",
          "symbols": []
        },
        {
          "operation": "session.time_left",
          "status": "supported",
          "symbols": [
            "TimeLeft"
          ]
        },
        {
          "operation": "session.connection_state",
          "status": "missing",
          "symbols": []
        },
        {
          "operation": "status.set",
          "status": "supported",
          "symbols": [
            "SetStatus"
          ]
        },
        {
          "operation": "bbs.command",
          "status": "missing",
          "symbols": []
        },
        {
          "operation": "lifecycle.exit",
          "status": "missing",
          "symbols": []
        },
        {
          "operation": "lifecycle.disconnect",
          "status": "missing",
          "symbols": []
        }
      ],
      "summary": {
        "supported": 5,
        "partial": 1,
        "missing": 5
      }
    },
    {
      "id": "aedoor",
      "kind": "historical-api",
      "rows": [
        {
          "operation": "terminal.write",
          "status": "missing",
          "symbols": []
        },
        {
          "operation": "terminal.read_key",
          "status": "missing",
          "symbols": []
        },
        {
          "operation": "terminal.read_line",
          "status": "missing",
          "symbols": []
        },
        {
          "operation": "session.identity",
          "status": "missing",
          "symbols": []
        },
        {
          "operation": "session.node",
          "status": "missing",
          "symbols": []
        },
        {
          "operation": "session.time_left",
          "status": "missing",
          "symbols": []
        },
        {
          "operation": "session.connection_state",
          "status": "missing",
          "symbols": []
        },
        {
          "operation": "status.set",
          "status": "missing",
          "symbols": []
        },
        {
          "operation": "bbs.command",
          "status": "missing",
          "symbols": []
        },
        {
          "operation": "lifecycle.exit",
          "status": "missing",
          "symbols": []
        },
        {
          "operation": "lifecycle.disconnect",
          "status": "missing",
          "symbols": []
        }
      ],
      "summary": {
        "supported": 0,
        "partial": 0,
        "missing": 11
      }
    },
    {
      "id": "ambos",
      "kind": "historical-api",
      "rows": [
        {
          "operation": "terminal.write",
          "status": "supported",
          "symbols": [
            "BBSWrite",
            "BBSPrintf"
          ]
        },
        {
          "operation": "terminal.read_key",
          "status": "missing",
          "symbols": []
        },
        {
          "operation": "terminal.read_line",
          "status": "missing",
          "symbols": []
        },
        {
          "operation": "session.identity",
          "status": "missing",
          "symbols": []
        },
        {
          "operation": "session.node",
          "status": "missing",
          "symbols": []
        },
        {
          "operation": "session.time_left",
          "status": "missing",
          "symbols": []
        },
        {
          "operation": "session.connection_state",
          "status": "missing",
          "symbols": []
        },
        {
          "operation": "status.set",
          "status": "missing",
          "symbols": []
        },
        {
          "operation": "bbs.command",
          "status": "missing",
          "symbols": []
        },
        {
          "operation": "lifecycle.exit",
          "status": "missing",
          "symbols": []
        },
        {
          "operation": "lifecycle.disconnect",
          "status": "partial",
          "symbols": [
            "BBSCarrier"
          ]
        }
      ],
      "summary": {
        "supported": 1,
        "partial": 1,
        "missing": 9
      }
    },
    {
      "id": "daydream",
      "kind": "historical-api",
      "rows": [
        {
          "operation": "terminal.write",
          "status": "supported",
          "symbols": [
            "DDPutStr",
            "DDPrintf"
          ]
        },
        {
          "operation": "terminal.read_key",
          "status": "supported",
          "symbols": [
            "DDGetKey"
          ]
        },
        {
          "operation": "terminal.read_line",
          "status": "partial",
          "symbols": [
            "Prompt"
          ]
        },
        {
          "operation": "session.identity",
          "status": "partial",
          "symbols": [
            "GetAccount"
          ]
        },
        {
          "operation": "session.node",
          "status": "missing",
          "symbols": []
        },
        {
          "operation": "session.time_left",
          "status": "supported",
          "symbols": [
            "TimeLeft"
          ]
        },
        {
          "operation": "session.connection_state",
          "status": "missing",
          "symbols": []
        },
        {
          "operation": "status.set",
          "status": "supported",
          "symbols": [
            "ChangeActivity"
          ]
        },
        {
          "operation": "bbs.command",
          "status": "supported",
          "symbols": [
            "InternalCommand"
          ]
        },
        {
          "operation": "lifecycle.exit",
          "status": "missing",
          "symbols": []
        },
        {
          "operation": "lifecycle.disconnect",
          "status": "partial",
          "symbols": [
            "Carrier"
          ]
        }
      ],
      "summary": {
        "supported": 5,
        "partial": 3,
        "missing": 3
      }
    },
    {
      "id": "door-io",
      "kind": "historical-api",
      "rows": [
        {
          "operation": "terminal.write",
          "status": "supported",
          "symbols": [
            "DoorPrint"
          ]
        },
        {
          "operation": "terminal.read_key",
          "status": "supported",
          "symbols": [
            "DoorGetKey"
          ]
        },
        {
          "operation": "terminal.read_line",
          "status": "supported",
          "symbols": [
            "DoorGetString"
          ]
        },
        {
          "operation": "session.identity",
          "status": "missing",
          "symbols": []
        },
        {
          "operation": "session.node",
          "status": "missing",
          "symbols": []
        },
        {
          "operation": "session.time_left",
          "status": "missing",
          "symbols": []
        },
        {
          "operation": "session.connection_state",
          "status": "missing",
          "symbols": []
        },
        {
          "operation": "status.set",
          "status": "missing",
          "symbols": []
        },
        {
          "operation": "bbs.command",
          "status": "missing",
          "symbols": []
        },
        {
          "operation": "lifecycle.exit",
          "status": "missing",
          "symbols": []
        },
        {
          "operation": "lifecycle.disconnect",
          "status": "missing",
          "symbols": []
        }
      ],
      "summary": {
        "supported": 3,
        "partial": 0,
        "missing": 8
      }
    },
    {
      "id": "fame",
      "kind": "historical-api",
      "rows": [
        {
          "operation": "terminal.write",
          "status": "missing",
          "symbols": []
        },
        {
          "operation": "terminal.read_key",
          "status": "missing",
          "symbols": []
        },
        {
          "operation": "terminal.read_line",
          "status": "missing",
          "symbols": []
        },
        {
          "operation": "session.identity",
          "status": "missing",
          "symbols": []
        },
        {
          "operation": "session.node",
          "status": "missing",
          "symbols": []
        },
        {
          "operation": "session.time_left",
          "status": "missing",
          "symbols": []
        },
        {
          "operation": "session.connection_state",
          "status": "missing",
          "symbols": []
        },
        {
          "operation": "status.set",
          "status": "missing",
          "symbols": []
        },
        {
          "operation": "bbs.command",
          "status": "missing",
          "symbols": []
        },
        {
          "operation": "lifecycle.exit",
          "status": "missing",
          "symbols": []
        },
        {
          "operation": "lifecycle.disconnect",
          "status": "missing",
          "symbols": []
        }
      ],